{
  "schema_version": "1",
  "trajectory_id": "01J9ZSZABCDEFGHJKMNPQRSTN1",
  "event_id": "01J9ZSZABCDEFGHJKMNPQRST11",
  "parent_event_id": "01J9ZSZABCDEFGHJKMNPQRST02",
  "event_type": "llm_turn",
  "timestamp": "2026-04-17T12:00:01.150Z",
  "agent_id": "leader",
  "payload": {
    "turn_id": "01J9ZSZABCDEFGHJKMNPQRST03",
    "summary": "User asked to read x.txt; assistant called Read."
  }
}
