{
  "schema_version": "1",
  "trajectory_id": "01J9ZSZABCDEFGHJKMNPQRSTVW",
  "event_id": "01J9ZSZABCDEFGHJKMNPQRST05",
  "parent_event_id": "01J9ZSZABCDEFGHJKMNPQRST04",
  "event_type": "tool_result",
  "timestamp": "2026-04-17T12:00:01.250Z",
  "agent_id": "leader",
  "payload": {
    "tool_call_id": "toolu_01",
    "duration_ms": 12,
    "success": true,
    "output": "file contents"
  }
}
