{
  "schema_version": "1",
  "trajectory_id": "01J9ZSZABCDEFGHJKMNPQRSTVW",
  "event_id": "01J9ZSZABCDEFGHJKMNPQRST03",
  "parent_event_id": "01J9ZSZABCDEFGHJKMNPQRST02",
  "event_type": "agent_message",
  "timestamp": "2026-04-17T12:00:01.100Z",
  "agent_id": "leader",
  "payload": {
    "turn_id": "01J9ZSZABCDEFGHJKMNPQRSTN1",
    "role": "assistant",
    "content": "hi"
  }
}
